### ISSUE TITLE
Unexpected RST Packet from Client During TLS Connection

### ISSUE THREAD

**Issue by andrewbytecoder** [prometheus/prometheus#16471]
### What did you do?

Certainly! Below is a sample bug report for Prometheus based on the Wireshark capture you provided. This report assumes that the issue might be related to Prometheus's behavior or configuration, but it could also involve other components in your environment.

---

#### Summary
While monitoring network traffic between a client and a Prometheus server using Wireshark, an unexpected RST packet was observed from the client side after a successful TLS handshake and data exchange. This behavior may indicate an issue with the connection handling or resource management within Prometheus or its associated services.

#### Steps to Reproduce
1. **Environment Setup**:
   - Prometheus Server Version: [Specify version]
   - Client Application: [Specify application details]
   - Network Configuration: [Describe any relevant network setup]

2. **Procedure**:
   - Establish a TCP connection between the client and the Prometheus server.
   - Perform a TLS handshake successfully.
   - Exchange application data over the established TLS connection.
   - Observe the network traffic using Wireshark.

3. **Expected Behavior**:
   - The connection should close gracefully with a proper four-way handshake (FIN/ACK sequence) after all data has been exchanged.

4. **Actual Behavior**:
   - After some data exchange, the client unexpectedly sends an RST packet, abruptly terminating the connection.

#### Wireshark Capture Details
- **Client IP**: 100.68.131.19
- **Server IP**: 10.54.64.101
- **Client Port**: 33340
- **Server Port**: 9100

**Relevant Packets**:
- Packet #952: Client sends FIN/ACK indicating the intention to close the connection.
- Packet #953: Server acknowledges the FIN/ACK.
- Packet #1013: Client sends an unexpected RST packet, abruptly terminating the connection.

#### Impact
The abrupt termination of connections via RST packets can lead to incomplete data transfers, potential data loss, and increased load on both the client and server due to frequent reconnections. This issue may also affect the reliability and performance of monitoring and alerting systems relying on Prometheus.

#### Additional Information
- **Prometheus Configuration**: Please provide any relevant Prometheus configuration files or settings that might influence connection handling.
- **Client Application Logs**: Include any logs from the client application that might indicate why it sent the RST packet.
- **Network Environment**: Describe any firewalls, load balancers, or other network devices that might be influencing the connection behavior.

#### Requested Actions
- Investigate the cause of the unexpected RST packet from the client during TLS connections with Prometheus.
- Provide recommendations or fixes to ensure connections are closed gracefully under normal circumstances.
- If this issue is not directly related to Prometheus, please advise on potential causes and suggest further troubleshooting steps.

#### Contact Information
- Reporter: andrewbytecoder
- Email: wangyazhoujy@gmail.com
- Organization: BTDYST

---

Feel free to adjust the details as necessary to better reflect your specific situation and environment.

### What did you see instead? Under which circumstances?

622 0.594412 100.68.131.19 10.54.64.101 TCP 74 33340 → 9100 [SYN] Seq=0 Win=64240 Len=0 MSS=1460 SACK_PERM TSval=219415844 TSecr=0 WS=256
623 0.0000147 100.68.131.19 10.54.64.101 TCP 74 9100 → 33340 [SYN, ACK] Seq=0 Ack=1 Win=65160 Len=0 MSS=1460 SACK_PERM TSval=3556079653 TSecr=219415844 WS=256
624 0.000025 100.68.131.19 10.54.64.101 TCP 66 33340 → 9100 [ACK] Seq=1 Ack=1 Win=64256 Len=0 TSval=219415844 TSecr=3556079653
625 0.000755 100.68.131.19 10.54.64.101 TLSv1.3 309 Client Hello
626 0.000040 10.54.64.101 100.68.131.19 TCP 66 9100 → 33340 [ACK] Seq=1 Ack=244 Win=65024 Len=0 TSval=3556079654 TSecr=219415845
627 0.347214 10.54.64.101 100.68.131.19 TLSv1.3 2308 Server Hello, Change Cipher Spec, Application Data, Application Data, Application Data, Application Data, Application Data
628 0.000066 100.68.131.19 10.54.64.101 TCP 66 33340 → 9100 [ACK] Seq=244 Ack=2243 Win=64000 Len=0 TSval=219416192 TSecr=35560800001
629 0.001588 100.68.131.19 10.54.64.101 TLSv1.3 160 Change Cipher Spec, Application Data, Application Data
630 0.000112 10.54.64.101 100.68.131.19 TCP 66 9100 → 33340 [ACK] Seq=2243 Ack=338 Win=65024 Len=0 TSval=35560800003 TSecr=219416194
631 0.000382 100.68.131.19 10.54.64.101 TLSv1.3 1274 Application Data
632 0.000048 10.54.64.101 100.68.131.19 TCP 66 9100 → 33340 [ACK] Seq=2243 Ack=1546 Win=64256 Len=0 TSval=35560800003 TSecr=219416194
633 0.000027 100.68.131.19 10.54.64.101 TLSv1.3 212 Application Data
634 0.000023 100.68.131.19 10.54.64.101 TCP 66 9100 → 33340 [ACK] Seq=2243 Ack=1692 Win=64256 Len=0 TSval=35560800004 TSecr=219416195
950 0.698859 100.68.131.19 10.54.64.101 TLSv1.3 90 Application Data
951 0.000066 10.54.64.101 100.68.131.19 TCP 66 9100 → 33340 [ACK] Seq=2243 Ack=1716 Win=64256 Len=0 TSval=3556084654 TSecr=219420845
952 0.000061 100.68.131.19 10.54.64.101 TCP 66 33340 → 9100 [FIN, ACK] Seq=1716 Ack=2243 Win=64256 Len=0 TSval=219420845 TSecr=3556084654
953 0.056602 10.54.64.101 100.68.131.19 TCP 66 9100 → 33340 [ACK] Seq=2243 Ack=1717 Win=64256 Len=0 TSval=3556084711 TSecr=219420845
1012 0.007354 10.54.64.101 100.68.131.19 TLSv1.3 172 Application Data
1013 0.000059 100.68.131.19 10.54.64.101 TCP 54 33340 → 9100 [RST] Seq=1717 Win=0 Len=0

### Prometheus version

```text

```

### Prometheus configuration file

```yaml

```

### Alertmanager version

```text

```

### Alertmanager configuration file

```yaml

```

### Logs

```text

```

**Comment by andrewbytecoder** [comment]
> I'm not sure what response you expect from a half written AI generated bug report, but you're basically wasting time.我不确定您希望从 AI 生成的半写错误报告中得到什么回应，但您基本上是在浪费时间。 At least do what the AI suggested: ` [Specify application details]`. The client details (node_exporter?) and logs from both sides would be useful here. This is likely an environment issue rather than anything in Prometheus or a component (e.g. a firewall/NAT/CGNAT at the system or network level).至少按照 AI 的建议操作： ` [Specify application details]` 。客户端详细信息（node_exporter？）以及来自两端的日志在这里会很有用。这可能是环境问题，而不是 Prometheus 或组件（例如系统或网络级别的防火墙/NAT/CGNAT）的问题。

Thanks for your reply, I will revise the description

**Comment by andrewbytecoder** [comment]
> I'm not sure what response you expect from a half written AI generated bug report, but you're basically wasting time. At least do what the AI suggested: ` [Specify application details]`. The client details (node_exporter?) and logs from both sides would be useful here. This is likely an environment issue rather than anything in Prometheus or a component (e.g. a firewall/NAT/CGNAT at the system or network level).

Thanks for your reply, I will revise the description

**Comment by krajorama** [comment]
Hello from the bug scrub,

this sounds like a bug in the node exporter given its error logs. 

Please check if you can fetch metrics from the node exporter manually by running 
```
curl https://10.54.64.101:9100/metrics
```
directly or via port-forward.

Since this issue is quite old and we don't see evidence of a Prometheus bug here, we're closing the issue. If you have evidence that this is a bug in node exporter, please open an issue on node exporter. In the more likely case this is configuration/k8s issue, please use the community channels for more support https://prometheus.io/community/.
